672d4a202b821a6b806941b3,2024-11-07T23:15:43.617Z,130,Research and Innovation,RESEARCH COMPLIANCE AND INTEGR,RESEARCH COMPLIANCE AND INTEGR,RESEARCH COMPLIANCE AND INTEGR,COI Office AI Project: UC San Diego Personal Assistant for Guidance on Engagements (PAGE) for Faculty and Researchers ,"Domestic and International collaborations are vital to UC San Diego’s research ecosystem. UC San Diego has been at the forefront and integral to understanding that the progress of science is based on interdisciplinary and collaborative. The current process is unclear and cumbersome.  In order to ensure success, UC San Diego must provide Researchers a tool to provide both guidance, actionable steps and a risk assessment of a collaboration or outside activity.

UC San Diego Researchers are requested to collaborate and engage with other researchers every day and around the world. Examples of these foreign and domestic engagements could be answering questions about a most recent publication, co-authoring a paper, sharing scientific materials or data, full scale U.S. government funded projects to visiting appointments at other universities, international scientific centers between universities, and everything else in between (i.e., teaching, educational programmatic development, sabbatical, etc.). Given the volume of UCSD researchers and the number of opportunities they are presented with, we need a sustainable and real-time solution to guide and analyze the risk level of the potential engagement and continued updates to the Researcher on new regulations or updates.

The Use Case:  
A UC San Diego Researcher with active federal funding has been invited by an outside entity (foreign or domestic) to present on their research, to collaborate on research, potentially be offered a visiting appointment, offered access to resources, and/or to teach. Primary questions when receiving such an invitation from Researchers are: 
•	What is permissible? 
•	Is prior approval required?
•	What system(s) is used for review and approval? 
•	When and who needs to be informed at UC San Diego and externally? 
•	Will the engagement impact current or future federal funding? 
•	What is considered a Malign Foreign Talent Recruitment Program (MFTRP), prohibited by federal agencies? 

Current Challenges: 
At this time, UC San Diego Researchers must review many websites and/or contact many central offices (such as, Departmental support or ARC, Academic Personnel Services, the COI Office, specific federal agency requirements, International Engagement, Travel, Risk Management, etc.) to fully understand all processes, IT systems, and policies to determine whether an invitation by an outside entity (foreign or domestic) is permissible, whether prior approval is required, what systems are used, and which offices must provide approval. Researchers must be informed of the risk levels of a potential collaboration, how to mitigate risks if necessary, and when to be transparent and disclose these collaborations within UC San Diego and to federal agencies. Most collaborations are considered low to medium risk and therefore UCSD researchers shouldn’t have to spend time reviewing websites or consulting with central offices.  There is currently no efficient and effective solution.
Why do UC San Diego Researchers need to be mindful about collaborations?
Since 2018, foreign influence reviews with the National Institutes of Health (NIH), NSPM-33, and the CHIPS and Science Act (prohibition of Malign FTRPs), taught educational institutions that collaborations (on behalf of UCSD or as an outside activity) with non-U.S. entities requires disclosure, due diligence, and scrutiny. Researchers must consider a risk-based approach when considering collaborations, because of the potential that the collaboration could have a damaging effect and cause foreign interference to the U.S. research enterprise.  UC San Diego already experienced the effect in 2018; and it must provide meaningful and supportive guidance to our UCSD Researchers in real-time when the Researcher is being invited to a collaborative opportunity. 

Why do we need UCSD AI PAGE? 
It is imperative that UCSD identify potential risks, so as not to inadvertently create an environment that halts international collaborations due to a Researcher’s confusion or lack of awareness on how to manage potential research security concerns. The UCSD AI PAGE tool will provide the supportive guidance, actionable steps and real-time mitigation when the UCSD Researcher is considering potential collaborative opportunities (within UCSD or independently as an outside activity) within a closed and private AI model. As new regulations and settlements become deployed, the UCSD AI PAGE tool will query all past interactions with a UCSD Researcher and produce a list of Researchers that should receive new and updated information (i.e. 1286 list FY22 released in 2023, and FY23 released in 2024). This with protect and provide immediate support to the Researcher while minimizing UCSD’s risk posture. 

In addition to UCSD AI PAGE’s ability to review and provide high level guidance on Export Controls regulations and sanctions on foreign countries, the U.S. Government has further expanded their concerns with countries of concern from China, Iran, North Korea, and Russia.  The U.S. Government has required Universities to assess if the research is considered within the definition of Critical Emerging Technologies (CET) the list of which is vastly broad and extensive. 

Given the inclusion by the U.S. government in 2023 of the prohibition of Malign FTRPs, UCSD researchers must be informed on what engagement risks may impact the ability to accept federal funding for their research. Since many engagement opportunities are not considered MFRTPs, UCSD researchers should not deny themselves these engagement opportunities. UCSD researchers need instant guidance, awareness, education, and the next steps of disclosure/regulations steps that include a clear risk level. Most opportunities are low risk, and Researchers need the support and guidance quickly and simply. The high risks can come from a country of concern, an entity or program on the 1286 list (from the Chips and Science Act), critical emerging technology, controlled technology, a sanctioned country, or include characteristics of an Malign FTRP, etc.  The high-risk determinations from UCSD AI PAGE would require the Researcher to schedule a meeting with RCI Research Security. 

The UCSD AI PAGE at its infancy will answer fundamental questions like, “I am a faculty member with federal research and have been invited to speak at x university (non-US entity) is this permissible and what do I need to do to disclose?” The results would provide the researcher with the policies and actionable steps required while identifying risk level and mitigation steps. 

The UCSD AI PAGE will diminish redundant reviews across many UCSD offices: UCSD AI PAGE would assist UCSD Researchers, departments, academic personnel (COC policies), the Conflict of Interest Office, RCI Research Security, Research Integrity and Oversight (RIO), International Offices (GI, international office), Export Control Office, risk management, travel, overall compliance, etc. 
",UCSD COI AI PAGE 2024 Final.docx,No
67254f3ded045e65dc5ddd45,2024-11-01T21:59:25.010Z,128,Chief Financial Officer,,,,TritonGPT Guided Buying Assistant ,"We have many systems for expenses at UC San Diego, and knowing the right system and required documentation for each use case can be difficult to manage. Guided Buying, as an interactive TritonGPT assistant, could close this gap. In Guided Buying, TritonGPT can display a series of prompts that guides users through a series of relevant questions/decision points to help them understand 1) the process for procuring or paying for what they're buying, 2) which system to do it with, 3) any relevant requirements/special conditions that may apply (ex. If trying to contract a service that a covered-employee also performs, you need sign off from Labor Relations first. Or, if you're buying a new piece of software, the Privacy and Security Teams need to be involved first). This would reduce training/ramp up time for new employees, reduce Services and Support questions, and reduce the percentage of transactions that are sent back for revisions due to not including the necessary information/documentation up front. ",,No
67129485f5a356eb75af2fa2,2024-10-18T17:01:57.743Z,124,RMP,,,,Cross reference Design Guidelines and Specifications,"Steven's Note: Not sure what Walter's VC Area is, so this was my best guess.

We have a 250+ page design guideline and thousands of pages of specifications that could be used as a LLM to cross check design submittals. Certain aspects are required design criteria that could be identified for all projects and use AI for preliminary reviews savings reviews by multiple SME's for initial pass. SME review is still required for unique design solutions but in general this could save substantial time on flagging items that don't follow standards.",,No
66f6ea55bcd98778fa840f3e,2024-09-27T17:24:37.164Z,119,Chief Financial Officer,INFORMATION TECHNOLOGY SVCS,INFORMATION TECHNOLOGY SVCS,INFORMATION TECHNOLOGY SVCS,Vision Assistant,"With the launch of Llama 3.2, 90B, we have the capability for TGPT to recognize the contents of an image file. Early tests show that it has the capability to ""analyze"" a chart or graph and help provide insights into the data being visualized. There are likely a host of other use cases. It may be worth starting with an assistant designed for this purpose then determining whether the ""vision"" capabilities can be folded into the other assistants. ",,No
66f6e843bcd98778fa84034d,2024-09-27T17:15:46.288Z,118,Chief Financial Officer,INFORMATION TECHNOLOGY SVCS,INFORMATION TECHNOLOGY SVCS,INFORMATION TECHNOLOGY SVCS,Internet Search Assistant,"We've had anecdotal requests wondering if TGPT can search the internet and bring back natural language responses, similar to Perplexity. Now that Danswer supports tool calling, we have the ability to do that and have identified a low cost utility that will perform this. ",,No
66f6e780bcd98778fa83ffcf,2024-09-27T17:12:31.326Z,117,Chief Financial Officer,INFORMATION TECHNOLOGY SVCS,INFORMATION TECHNOLOGY SVCS,INFORMATION TECHNOLOGY SVCS,Suspicious Email Reviewer,Copy and paste the contents of an email into an assistant and get an analysis and risk score of how likely the email is to be a phishing attempt. ,,No
66ed9b518548cd9295eda018,2024-09-20T15:57:04.322Z,115,Chief Financial Officer,,,,Virtual Agent for CRM,"Integrated Procure-to-Pay Solutions (IPPS) handles a large number of inquiries from both internal and external clients that are vital to the university's day-to-day functioning (approx 40,000/year). IPPS's tier 1 support queues take up around 43.35% of our total case volume within Services & Support. Our agents are able to manage an average of 95 cases per week but face overutilization due to other projects and tasks that are associated with their job card. The case count stands around 148 per queue which exceeds capacity by 55.79% and impedes on our ability to resolve cases within our 24 hour desired window. When queues are backed up, this can lead to a ripple effect, causing dissatisfaction among the university's suppliers, delays in research projects due to missing goods, and other significant consequences.

Our solution is to look for a virtual agent that can support our case volume and reduce the amount of cases that are sent to our teams. The virtual agent would be available in the hours our agents are unable to work, answer the status questions, and provide instructions to clients seeking to understand our processes better. This will significantly reduce the workload of human agents, resulting in tangible cost savings by eliminating the need to hire extra resources. Our agents would also be able to work on other initiatives such as outreach to clients and optimizing training material. We are in the process of searching for a virtual agent through an RFI with other stakeholders in the university to ensure we are sourcing the appropriate solution. In addition to our research, we have begun to identify resources that need to be updated, which should lighten the lift of preparation during the implementation stage. We hope to procure a virtual agent in the future or similar solution that allows us to respond to our inquiries sooner and provide a better experience to our clients. 
",,No
66ed9aa683e44a823c2f5ac9,2024-09-20T15:54:13.298Z,114,Chief Financial Officer,,,,RPA - Robotic Process Automation,"Integrated Procure-to-Pay Solutions (IPPS) handles a large number of inquiries from both internal and external clients that are vital to the university's day-to-day functioning (approx 40,000/year). IPPS's tier 1 support queues take up around 43.35% of our total case volume within Services & Support. Our agents are able to manage an average of 95 cases per week but face overutilization due to other projects and tasks that are associated with their job card. The case count stands around 148 per queue which exceeds capacity by 55.79% and impedes on our ability to resolve cases within our 24 hour desired window. When queues are backed up, this can lead to a ripple effect, causing dissatisfaction among the university's suppliers, delays in research projects due to missing goods, and other significant consequences.

Our solution is to look for a virtual agent that can support our case volume and reduce the amount of cases that are sent to our teams. The virtual agent would be available in the hours our agents are unable to work, answer the status questions, and provide instructions to clients seeking to understand our processes better. This will significantly reduce the workload of human agents, resulting in tangible cost savings by eliminating the need to hire extra resources. Our agents would also be able to work on other initiatives such as outreach to clients and optimizing training material. We are in the process of searching for a virtual agent through an RFI with other stakeholders in the university to ensure we are sourcing the appropriate solution. In addition to our research, we have begun to identify resources that need to be updated, which should lighten the lift of preparation during the implementation stage. We hope to procure a virtual agent in the future or similar solution that allows us to respond to our inquiries sooner and provide a better experience to our clients. 
",,No
66e31a65ac82e9c98d940de7,2024-09-12T16:44:21.147Z,112,Academic Affairs,ACADEMIC PERSONNEL SERVICES,ACADEMIC PERSONNEL SERVICES,ACADEMIC PERSONNEL SERVICES,Faculty BioBibs into Interfolio Faculty 180,"Create a TritonGPT Task-Specific AI Assistant that could take a faculty member’s current BioBib document (in the correct UC format as a PDF or Word document) and place the information properly into the Interfolio Faculty180 tool which can then output the information in a variety of desired formats (BioBib style, NSF style, NIH style, etc.).  This would be extremely helpful in getting all of our faculty BioBibs into Interfolio in a way that promotes transparency throughout the academic review process.",,No
66e1bc5847bef54305ddf015,2024-09-11T15:50:47.451Z,110,Marine Sciences & SIO,,,,TGPT sandbox for developing proof-of-concept business solutions,"Several of us at the SIO-BI team have been following closely the TGPT development since its inception and ""playing"" around with it.   Similarly, we've also been exploring Gemini, MS Co-pilot, ChatGPT and looking for productivity gains where possible.  Lately, I've been exploring semantic search as a potential tool to help in two separate use cases and have run into the issue of data security.  In one case, utilizing unstructured Academic Personnel data, we have P2 and P3 data so we need to tokenize and prompt for it in a secure environment.  We have an entire database of historical data and are obviously not a candidate for existing tools since we need both, a safe repository for the tokenized data and a secure LLM which will not use said data for training purposes, or will clearly state the data will be deleted within a particular time frame.  

Since TGPT is housed in a safe, closed and secure environment at the SDSC, we would like to know if there are plans for allow UCSD Divisions, Department to have access to the same infrastructure.  Ideally, a sandbox scenario where we could store tokens, ie. a vector database, and a Llama LLM would provide enough to develop proof-of-concept business solutions in the short term.   If we have success we may be able to build our own environment for a production level solution since stakeholders would see the benefits and fund it.   Of course, we would cover set up costs for a sandbox at SDSC if that option was available. 
",,No
66da36b84af5a05b0ad8199a,2024-09-05T22:54:47.946Z,108,Chief Financial Officer,,,,RPA - Robotic Process Automation,"Robotic Process Automation involves software bots and AI agents automating repetitive tasks. In an effort to increase transaction efficiency and reduce the resources required, RPA could automate tasks that aren't candidates for normal integrations or aren't likely to be prioritized by central IT resources. 

IPPS processes more than 1.3M transactions a year, and while we've automated the vast majority of them, we still have many time consuming manual processes. I can think of more than a dozen processes IPPS could automate with RPA - and imagine there are many, many more possible examples across campus. Some examples of IPPS processes we haven't been able to automate in other ways  - 1) issuing new P-Cards/Travel & Entertainment cards in the US Bank portal after the new card request in Concur is fully approved, 2) automatically reducing the P-Card/T&E Card limit for cardholders who haven't reconciled within policy requirements - and then increasing the limit if/when they do, 3) enter wire payments into the bank portal after the SNOW request form is fully approved, 4) automate the process of moving checks that haven't been cashed in 6 months to the unclaimed accounts, 5) Setting up new gift card sub-teams in Tremendous for human subject payments after the associated PO is fully approved/issued, etc.

Several other higher eds have presented on their recent successes implementing RPA - here's an example: https://s3.amazonaws.com/bee-content/beeUploadedFiles/33501097/44310b96-8e1c-4657-bb9a-8572374e8f86_StreamliningProcurementHarnessingthePowerofRoboticProcessAutomation.pdf
",,No
66da33314af5a05b0ad7f50c,2024-09-05T22:39:44.845Z,107,Chief Financial Officer,,,,AppZen for Concur Expense Report Auditing ,"Problem: Expense Reports (for travel, events, P-Card, or misc. employee reimbursement) require strict review to ensure compliance with policy and guard against fraud. Policies are complex, and expense reports typically involve after-the-fact reviews, which complicate review and can delay approvals. Pierre has challenged us to reduce the amount of manual reviews we do to only 10% of travel transactions  - and auto approve 90%. We've managed to increase out auto-approval percentage from 46% to 73% in the last FY, but struggle to find additional areas we can bypass review on without exposing the university to too much risk . 

Potential Solution: AppZen (https://www.appzen.com/expense-audit-software) is a 3rd party application that integrates with Concur and runs all expense reports against dynamic rules and uses AI (OCR, NLP) to review receipts, compare expenses across different users and transactions to prevent duplicate/fraudulent reimbursements, and more to quickly (within 15 mins) analyze the risk of each expense as low, medium, or high. Only expenses that are high risk require manual review, and over time the system learns how we typically handle different risks and learns to automate review even further. 

We've had a demo and are impressed, and are trying to learn about their pricing model.",,No
66d09fa18e485a95a37d7678,2024-08-29T16:19:44.017Z,106,Chancellor,ETHICS AND COMPLIANCE,ETHICS AND COMPLIANCE,ETHICS AND COMPLIANCE,Closed Circuit AI Assistant for Ethics & Compliance ,"TritonGPT closed circuit AI Assistant for Ethics & Compliance, to be trained on specific UC policies related to assessment and processing of misconduct allegations (UC Whistleblower Policy, Whistleblower Protection Policy, Sexual Violence & Sexual Harassment Policy, Anti-discrimination Policy, Abusive Conduct Policy, etc.).  AI Assistant would be used by the investigative staff managing high-risk investigations to ask specific questions across these policies and would be used to process time intensive investigation work.  For example, the AI Assistant would be provided investigator notes from witness interviews and could provide a witness summary for inclusion in an investigative report that references the appropriate policy language and meets the formatting/template requirements of the office. Output would need to be verified by the investigator, but the time savings is anticipated to be substantial.  This would allow investigative staff to focus on higher level skills and judgment in addressing misconduct, freeing them up from administrative and process minutiae that can be processed by AI.  

Character limitations would need to be higher than current restrictions on TritonGPT to allow for submission of larger amounts of information for summarization. Utilization would be restricted to data types and levels currently approved for use with the AI.  ",,No
66ce3dc7320ac7938569ecfc,2024-08-27T20:57:42.462Z,104,Chief Financial Officer,,,,Oracle Supplier/Payee Search Tool ,"Problem: We have 70,000 (non-employee) suppliers/payees in our supplier master. Each supplier/payee we add takes time to setup, requires maintenance, and introduces risk into the university. The ideal behavior would be to source goods/services from existing suppliers when something is needed, but there's not currently a good way to identify what the existing suppliers sell/provide.  

Idea: Create a tool that campus can use to search across all payees/suppliers in Oracle. What they sell can be sourced through past orders/payments to them by others, and NPL can help interpret what the user is looking for - even if they don't use the exact same terms. We could give weight/preference in search results to UC agreement suppliers, or local/diverse/small businesses - and even potentially pair it with information from Blink that gives additional guidance on certain high risk commodities (like events, security services, etc).  We had a similar tool pre-ESR, the Marketplace Supplier Search Tool, which was homegrown. At that time, we asked payees what they sold during registration, and used that to match potential suppliers for campus but it was too dependent on matching exact terms that suppliers vs. campus used. I feel like AI could really improve that experience, without too much effort.  ",,No
66ce3d7c320ac7938569e6e6,2024-08-27T20:56:27.459Z,103,Chief Financial Officer,,,,"Lab, Experiment, and Procurement Efficiencies: Accelerating Experiment Life Cycle for Research","This is a joint exploration between Jacob's School of Engineering's Laboratory for Emerging Intelligence and IPPS which consists of a series of related AI solutions that result in researchers being able to get from an idea for an experiment to actually performing the research more quickly. Jacobs is pursuing a financial gift from Fisher Scientific, in the aims of accelerating research. Project scope includes: 
1) Lab and Experimental Data Intelligence 
2) Lab and Procurement Analytics 
3) Lab Efficiencies and Guided Buying 
4) Virtual Lab Management ",,Yes
66ccb507efff46a5d23b1643,2024-08-26T17:01:59.060Z,102,Chief Financial Officer,,,,Guided Buying/P2P Orchestration (Oro Labs Proof of Concept) ,"We have many systems for expenses at UC San Diego, and knowing the right system and required documentation for each use case can be difficult to manage. Guided Buying, a single front door for all P2P activities that then directs users to the right place, could close this gap. Guided Buying uses a combination of AI (NPL, GenAI) to take a basic description of what someone is trying to do, and then guide them through a series of relevant questions/decision points to get them to the correct place. Fully fleshed out, it could also serve as solution for P2P Orchestration - providing not only a guide but a sophisticated piece of middleware that serves as a single intake portal and then facilitates integrations between all P2P systems to create/submit/approve/etc. various transactions. With over 1.3 million transactions taking place in the P2P space every year, the ability to consolidate and streamline these processes could lead to significant time savings and a reduction in administrative burden. ",,Yes
